{
  "schema_version": 1,
  "spec_version": "0.1",
  "generated_at": "2026-10-24T17:46:57+00:00",
  "adapter": {
    "version": "0.1.0"
  },
  "python": {
    "tested": [
      "3.11",
      "3.12",
      "3.13"
    ],
    "minimum": "3.11"
  },
  "a2a_protocol": {
    "supported": [
      "1.0"
    ]
  },
  "a2a_sdk": {
    "declared": ">=1.2.0,<1.3",
    "tested": [
      "1.2.0",
      "1.2.1",
      "1.2.2",
      "1.2.3"
    ],
    "known_broken": []
  },
  "lemonade": {
    "tested": [
      "2026.40.0"
    ],
    "minimum": "2026.40.0"
  },
  "evidence": {
    "canary": {
      "run_at": "2026-10-24T17:46:37+00:00",
      "python": "3.11.7",
      "results": [
        {
          "requested": "1.2.0",
          "status": "passed",
          "a2a_sdk": "1.2.0",
          "tests": {
            "tests": 447,
            "failures": 0,
            "errors": 0,
            "skipped": 1
          },
          "doctor": "pass",
          "tck": "passed",
          "tck_patched": "passed"
        },
        {
          "requested": "1.2.1",
          "status": "passed",
          "a2a_sdk": "1.2.1",
          "tests": {
            "tests": 447,
            "failures": 0,
            "errors": 0,
            "skipped": 1
          },
          "doctor": "pass",
          "tck": "passed",
          "tck_patched": "passed"
        },
        {
          "requested": "1.2.2",
          "status": "passed",
          "a2a_sdk": "1.2.2",
          "tests": {
            "tests": 447,
            "failures": 0,
            "errors": 0,
            "skipped": 1
          },
          "doctor": "pass",
          "tck": "passed",
          "tck_patched": "passed"
        },
        {
          "requested": "1.2.3",
          "status": "passed",
          "a2a_sdk": "1.2.3",
          "tests": {
            "tests": 447,
            "failures": 0,
            "errors": 0,
            "skipped": 1
          },
          "doctor": "pass",
          "tck": "passed",
          "tck_patched": "passed"
        }
      ]
    },
    "tck": {
      "commit": "263b9cfaf16a554bdfb166a7ba5b67716e946349",
      "status": "passed",
      "test_cases": {
        "passed": 157,
        "skipped": 104,
        "xfailed": 4
      },
      "run_at": "2026-10-07T13:53:57+00:00"
    }
  }
}
